{
  "$schema": "../schemas/community-directory.schema.json",
  "schema": "meshcore-canada-communities/v1",
  "metadata": {
    "owner": "directory-stewards",
    "migrated_at": "2026-07-19",
    "source_revision": "a47dfbc",
    "review_by": "2027-01-15",
    "update_route": "../submit-idea.md"
  },
  "national_defaults": {
    "radio_preset": "USA/Canada (Recommended)",
    "raw_radio": {
      "frequency_mhz": 910.525,
      "bandwidth_khz": 62.5,
      "spreading_factor": 7,
      "coding_rate": 5
    },
    "path_hash_mode": "3-byte",
    "cli_path_setting": "set path.hash.mode 2"
  },
  "directory_pages": [
    {
      "slug": "british-columbia",
      "title": "British Columbia",
      "codes": [
        "BC"
      ],
      "aliases": [
        "BC"
      ]
    },
    {
      "slug": "alberta",
      "title": "Alberta",
      "codes": [
        "AB"
      ],
      "aliases": [
        "AB"
      ]
    },
    {
      "slug": "saskatchewan",
      "title": "Saskatchewan",
      "codes": [
        "SK"
      ],
      "aliases": [
        "SK"
      ]
    },
    {
      "slug": "manitoba",
      "title": "Manitoba",
      "codes": [
        "MB"
      ],
      "aliases": [
        "MB"
      ]
    },
    {
      "slug": "ontario",
      "title": "Ontario",
      "codes": [
        "ON"
      ],
      "aliases": [
        "ON"
      ]
    },
    {
      "slug": "quebec",
      "title": "Quebec",
      "codes": [
        "QC"
      ],
      "aliases": [
        "Québec",
        "QC"
      ]
    },
    {
      "slug": "new-brunswick",
      "title": "New Brunswick",
      "codes": [
        "NB"
      ],
      "aliases": [
        "NB"
      ]
    },
    {
      "slug": "nova-scotia",
      "title": "Nova Scotia",
      "codes": [
        "NS"
      ],
      "aliases": [
        "NS"
      ]
    },
    {
      "slug": "prince-edward-island",
      "title": "Prince Edward Island",
      "codes": [
        "PE"
      ],
      "aliases": [
        "PEI",
        "PE"
      ]
    },
    {
      "slug": "newfoundland-and-labrador",
      "title": "Newfoundland and Labrador",
      "codes": [
        "NL"
      ],
      "aliases": [
        "Newfoundland",
        "Labrador",
        "NL"
      ]
    },
    {
      "slug": "territories",
      "title": "the territories",
      "codes": [
        "YT",
        "NT",
        "NU"
      ],
      "aliases": [
        "Yukon",
        "Northwest Territories",
        "Nunavut",
        "YT",
        "NT",
        "NU"
      ]
    }
  ],
  "province_contacts": [
    {
      "id": "alberta-meshcore-canada-telegram",
      "province": "AB",
      "type": "telegram",
      "label": "Alberta topic in MeshCore Canada",
      "url": "https://t.me/MeshCoreCAN",
      "health": "needs-review",
      "last_checked": null
    }
  ],
  "communities": [
    {
      "id": "salish-mesh",
      "name": "Salish Mesh",
      "province": "BC",
      "service_area": "Salish Sea and surrounding area",
      "places": [
        "Salish Sea"
      ],
      "aliases": [
        "Salish Mesh"
      ],
      "status": "active",
      "languages": [],
      "location": {
        "latitude": null,
        "longitude": null,
        "precision": "service-area"
      },
      "settings": {
        "inherit_national": true,
        "overrides": {}
      },
      "contacts": [
        {
          "type": "website",
          "label": "Salish Mesh website",
          "url": "https://salishmesh.net/",
          "health": "needs-review",
          "last_checked": null
        }
      ],
      "owner": null,
      "verified_at": null,
      "verify_by": null,
      "canonical_route": "/provinces/british-columbia/#community-salish-mesh"
    },
    {
      "id": "alberta-meshcore-networks",
      "name": "Alberta MeshCore Networks",
      "province": "AB",
      "service_area": "Alberta",
      "summary": "Building Alberta's community-operated off-grid LoRa mesh network",
      "places": [
        "Airdrie",
        "Calgary",
        "Edmonton",
        "Lethbridge"
      ],
      "aliases": [
        "AlbertaMesh",
        "AlbertaMesh.ca",
        "Alberta MeshCore"
      ],
      "status": "active",
      "languages": [],
      "location": {
        "latitude": null,
        "longitude": null,
        "precision": "service-area"
      },
      "settings": {
        "inherit_national": true,
        "overrides": {}
      },
      "contacts": [
        {
          "type": "website",
          "label": "AlbertaMesh.ca",
          "url": "https://albertamesh.ca/",
          "health": "needs-review",
          "last_checked": null
        },
        {
          "type": "discord",
          "label": "Alberta MeshCore Discord",
          "url": "https://discord.gg/CznDhsRWnJ",
          "health": "needs-review",
          "last_checked": null
        },
        {
          "type": "website",
          "label": "Airdrie regional page",
          "url": "https://albertamesh.ca/airdrie/",
          "health": "needs-review",
          "last_checked": null
        },
        {
          "type": "website",
          "label": "Calgary regional page",
          "url": "https://albertamesh.ca/calgary/",
          "health": "needs-review",
          "last_checked": null
        },
        {
          "type": "website",
          "label": "Edmonton regional page",
          "url": "https://albertamesh.ca/edmonton/",
          "health": "needs-review",
          "last_checked": null
        },
        {
          "type": "website",
          "label": "Lethbridge regional page",
          "url": "https://albertamesh.ca/lethbridge/",
          "health": "needs-review",
          "last_checked": null
        },
        {
          "type": "website",
          "label": "Why MeshCore?",
          "url": "https://albertamesh.ca/why-meshcore/",
          "health": "needs-review",
          "last_checked": null
        },
        {
          "type": "website",
          "label": "Monitoring tools",
          "url": "https://albertamesh.ca/monitoring-tools/",
          "health": "needs-review",
          "last_checked": null
        }
      ],
      "owner": null,
      "verified_at": null,
      "verify_by": null,
      "canonical_route": "/provinces/alberta/#community-alberta-meshcore-networks"
    },
    {
      "id": "airdrie-meshcore-network",
      "name": "Airdrie MeshCore Network",
      "province": "AB",
      "service_area": "Airdrie and Calgary",
      "summary": "Uses the YYC regional identifier shared with the Calgary regional network",
      "places": [
        "Airdrie",
        "Calgary"
      ],
      "aliases": [
        "AlbertaMesh Airdrie",
        "YYC"
      ],
      "status": "active",
      "languages": [],
      "location": {
        "latitude": 51.2812,
        "longitude": -113.99718,
        "precision": "approximate"
      },
      "settings": {
        "inherit_national": true,
        "overrides": {}
      },
      "contacts": [
        {
          "type": "website",
          "label": "Airdrie MeshCore Network",
          "url": "https://albertamesh.ca/airdrie/",
          "health": "needs-review",
          "last_checked": null
        },
        {
          "type": "website",
          "label": "Airdrie configuration guide",
          "url": "https://albertamesh.ca/airdrie/configuration/",
          "health": "needs-review",
          "last_checked": null
        },
        {
          "type": "discord",
          "label": "Alberta MeshCore Discord",
          "url": "https://discord.gg/CznDhsRWnJ",
          "health": "needs-review",
          "last_checked": null
        },
        {
          "type": "meshmapper",
          "label": "Airdrie network map",
          "url": "https://yyc.meshmapper.net/?lat=51.28120&lon=-113.99718&zoom=13.43",
          "health": "needs-review",
          "last_checked": null
        },
        {
          "type": "website",
          "label": "WAeV live map",
          "url": "https://waev.app/#/live-map/@51.28107,-113.99966,14.47z",
          "health": "needs-review",
          "last_checked": null
        }
      ],
      "owner": null,
      "verified_at": null,
      "verify_by": null,
      "canonical_route": "/provinces/alberta/#community-airdrie-meshcore-network"
    },
    {
      "id": "calgary-area-meshcore",
      "name": "Calgary and Area MeshCore",
      "province": "AB",
      "service_area": "Calgary and area",
      "places": [
        "Calgary"
      ],
      "aliases": [
        "Calgary and area",
        "YYC"
      ],
      "status": "active",
      "languages": [],
      "location": {
        "latitude": null,
        "longitude": null,
        "precision": "service-area"
      },
      "settings": {
        "inherit_national": true,
        "overrides": {}
      },
      "contacts": [
        {
          "type": "telegram",
          "label": "Calgary topic in Mesh Alberta",
          "url": "https://t.me/meshtAlta",
          "health": "needs-review",
          "last_checked": null
        },
        {
          "type": "discord",
          "label": "Canada - Calgary, Alberta & Area regional channel in the MeshCore Discord",
          "url": null,
          "health": "needs-review",
          "last_checked": null
        }
      ],
      "owner": null,
      "verified_at": null,
      "verify_by": null,
      "canonical_route": "/provinces/alberta/#community-calgary-area-meshcore"
    },
    {
      "id": "calgary-meshcore-network",
      "name": "Calgary MeshCore Network",
      "province": "AB",
      "service_area": "Calgary",
      "summary": "Initial AlbertaMesh.ca launch region",
      "places": [
        "Calgary"
      ],
      "aliases": [
        "AlbertaMesh Calgary",
        "YYC",
        "meshcorecalgary.ca"
      ],
      "status": "active",
      "languages": [],
      "location": {
        "latitude": 51.01674,
        "longitude": -114.00149,
        "precision": "approximate"
      },
      "settings": {